{"artifact_class":"a0-activation-receipt","claim_ids":[],"corpus":{"cases_sha256":"4d667a5b8e7512ee19feeedc37e2562413ace27fdd1220654ef79edcb8616707","manifest_sha256":"68eda0c1082b36b17836cb79684c5696280486ae93596109562853160f25d58f","sealed_targets_accessed":true,"sealed_targets_sha256":"8b820294103ce748f65b49aa46e2e85ce584add8c058bb2d4129aadf366e7162","selected_cases":48,"selected_families":24},"created_at":"2026-08-15T00:45:00Z","dense_vectors":{"bytes":4214608,"format":"safetensors","locator":"artifacts/a0/a0-v1.0.3-e93a9faa/activations.safetensors","sha256":"61cc0a472f0b3066b06ae06ed46ee6ea033836e6b306aaa7a336fc1ec50b41bd"},"empirical":true,"environment":{"device":"cpu","dtype":"float32","implementation":"CPython","offline":true,"packages":{"numpy":"2.4.6","safetensors":"0.8.0","torch":"2.13.0","transformers":"5.15.0"},"platform":"macOS-15.7.3-arm64-arm-64bit","python":"3.11.13"},"evidence_eligible":false,"expert_validated":false,"layer_index_semantics":"hidden_states_tuple_index_including_embedding_at_zero","layers":[0,2,4,6],"model":{"id":"EleutherAI/pythia-70m-deduped","revision":"e93a9faa9c77e5d09219f6c868bfc7a1bd65593c","runtime_files":[{"name":"README.md","sha256":"0b8eff9fd326d9089f00c4984db07f89a9dac674ae3191a9bc8ae128b8a37580","size":13677},{"name":"config.json","sha256":"002050231a9b1ec3ac77aa6b9b3bbdc4d923f4068a7dd33b8da72a9bd6ad9a43","size":567},{"name":"model.safetensors","sha256":"3da388330e4549156d76b58d6d268c63cd005e9336b4f4d2d378421e7b7a33fd","size":166029852},{"name":"special_tokens_map.json","sha256":"6f50ab5a5a509a1c309d6171f339b196a900dc9c99ad0408ff23bb615fdae7ad","size":99},{"name":"tokenizer.json","sha256":"c24618a1b3e6a38167beff1c72cffd126c3a66254347304b50547d12c5f25624","size":2113710},{"name":"tokenizer_config.json","sha256":"70e38394e494931c6f773ba41e19460dd4436526b852207367f04341b4066d3f","size":396}]},"protocol":{"freeze_manifest_sha256":"a15e83c65573f50153f8608c9536e3bc4c60a1505fd939ec98ec97013a9407e1","id":"a0-automated-weak-proxy-v1.0.3","implementation_sha256":"2d08085d8cfc566f62b1b414c6ca09ad23af8df67de0fbd6876a896783721df9","sha256":"f49d4e53f86d35ae6a44642978e4993a0c6e7b3f4782a208faf695d8f6451d99"},"records":1920,"representation_index":{"path":"representations-index.jsonl","sha256":"cfc53198eda44738b3c468ffb5581c659c025e8c3ebdd7ba57fe27198a60c089"},"scientific_status":"exploratory","status":"pass","token_sites":["sentinel","final_transformation_token","mean_transformation_span"],"tokenizer":{"class":"GPTNeoXTokenizer","id":"EleutherAI/pythia-70m-deduped","is_fast":true,"revision":"e93a9faa9c77e5d09219f6c868bfc7a1bd65593c"},"views":["problem_only","transformation_only","problem_plus_transformation","problem_plus_solution"]}
